id,time1,"Lorem ipsum dolor sit amet, consectetur adipiscing elit, sed do eiusmod tempor incididunt ut labore et dolore magna aliqua. Montes nascetur ridiculus mus mauris. Consequat id porta nibh venenatis cras sed felis. Id interdum velit laoreet id donec ultrices tincidunt arcu non. Faucibus interdum posuere lorem ipsum. Ipsum dolor sit amet consectetur adipiscing elit duis. Id neque aliquam vestibulum morbi blandit cursus risus at ultrices. Feugiat scelerisque varius morbi enim nunc faucibus a. Velit ut tortor pretium viverra. Consectetur adipiscing elit duis tristique sollicitudin nibh sit amet commodo. Erat imperdiet sed euismod nisi porta lorem."2,Nullam eget felis eget nunc lobortis. Turpis massa tincidunt dui ut ornare lectus. Iaculis eu non diam phasellus vestibulum lorem sed risus. Tincidunt vitae semper quis lectus nulla at. Quam pellentesque nec nam aliquam sem et. Cras fermentum odio eu feugiat pretium nibh ipsum consequat. Mauris in aliquam sem fringilla ut morbi tincidunt augue interdum. Lectus sit amet est placerat in egestas. Scelerisque purus semper eget duis at tellus. Fermentum leo vel orci porta. Pellentesque diam volutpat commodo sed egestas egestas fringilla phasellus. Aliquet sagittis id consectetur purus ut faucibus pulvinar elementum. Dolor purus non enim praesent elementum facilisis leo vel.3,Pellentesque id nibh tortor id aliquet. Adipiscing elit duis tristique sollicitudin. Commodo nulla facilisi nullam vehicula ipsum. Ornare aenean euismod elementum nisi quis. Pulvinar mattis nunc sed blandit libero volutpat sed. Proin fermentum leo vel orci. Tincidunt ornare massa eget egestas purus. Quis enim lobortis scelerisque fermentum dui faucibus. Quisque non tellus orci ac auctor. Est velit egestas dui id ornare. Morbi tempus iaculis urna id.4,Nulla facilisi etiam dignissim diam. Pellentesque massa placerat duis ultricies lacus sed turpis tincidunt id. Blandit turpis cursus in hac habitasse platea dictumst quisque. Risus quis varius quam quisque id. Ultricies leo integer malesuada nunc vel risus commodo viverra maecenas. Cursus in hac habitasse platea. Urna et pharetra pharetra massa massa ultricies mi quis hendrerit. Posuere lorem ipsum dolor sit amet consectetur. Volutpat commodo sed egestas egestas fringilla. Arcu non odio euismod lacinia at. Tempus imperdiet nulla malesuada pellentesque elit eget. Semper feugiat nibh sed pulvinar proin gravida hendrerit lectus a. Id neque aliquam vestibulum morbi blandit cursus risus. Sed lectus vestibulum mattis ullamcorper velit sed ullamcorper. Malesuada fames ac turpis egestas sed.5,Blandit turpis cursus in hac. Diam quam nulla porttitor massa id neque. Nulla porttitor massa id neque aliquam vestibulum. Diam in arcu cursus euismod quis. Convallis tellus id interdum velit laoreet id. Nec sagittis aliquam malesuada bibendum arcu vitae elementum curabitur. Bibendum neque egestas congue quisque egestas diam in arcu. Purus sit amet volutpat consequat mauris nunc congue nisi vitae. Nunc non blandit massa enim. Vel quam elementum pulvinar etiam non quam lacus. In cursus turpis massa tincidunt dui ut ornare lectus sit. Commodo quis imperdiet massa tincidunt nunc pulvinar sapien. Viverra mauris in aliquam sem fringilla ut morbi tincidunt. Viverra aliquet eget sit amet tellus cras adipiscing enim eu. At varius vel pharetra vel. Egestas diam in arcu cursus euismod quis viverra nibh cras. Viverra mauris in aliquam sem. Malesuada fames ac turpis egestas maecenas pharetra.6,Eget felis eget nunc lobortis mattis aliquam faucibus purus in. Porttitor lacus luctus accumsan tortor. Sed risus ultricies tristique nulla aliquet enim tortor at auctor. Elit scelerisque mauris pellentesque pulvinar pellentesque habitant. Et netus et malesuada fames ac turpis egestas. Non quam lacus suspendisse faucibus interdum posuere lorem ipsum dolor. Sit amet risus nullam eget. Id interdum velit laoreet id donec. Ut lectus arcu bibendum at. Amet consectetur adipiscing elit duis tristique sollicitudin. Aliquam purus sit amet luctus venenatis lectus. Sem et tortor consequat id porta nibh venenatis.